title,creator,description,date,Date Approximate,subjects,source,publisher,book-relationship,identifier-original,format-original,format,type,rights,language,location,geonames,latitude,longitude,link,object-idLogs Exiting the Log Chute,C.H. Gregary,"Milwaukee Lumber Company log chute, St. Joe National Forest. A man looks on as fire damaged logs are chuted to the log pond. Credit to U.S.D.A. Forest Service.",1/1/20,,salvage logging; log (wood); flowage; chutes; ponds (water);,"PG 6069 MG 69, White Pine: King of Many Waters Collection",Mountain Press Publishing Company,WPKOMW p. 40,69_2_B-38,black and white print,image/jpg,Image;StillImage,"Digital image, University of Idaho Library, 2015.",,"Rochat Creek, Benewah County, Idaho, United States",http://www.geonames.org/5605533/rochat-creek.html,47.3288,-116.4556,http://digital.lib.uidaho.edu:80/cdm/ref/collection/whitepine/id/81,81Chute meets Flume,,Winston Lumber Company Falls Creek Chute and Flume. According to Dick Reed this was a running chute most of the time  but a man and horse were kept near the junction in case the logs stopped before they got to the flume. Generally the logs entered the flume of their own momentum. Note the tow path to the left of the junction. The white spot is a plume of water thrown up when the log from the chute plunged into the water in the flume. You can also see another log in the chute about ready to hit the flume. Courtesy Tom Reed.,1/1/25,,chutes; log (wood); flumes;,"PG 6069 MG 69, White Pine: King of Many Waters Collection",Mountain Press Publishing Company,WPKOMW p. 119,69_2_B-39,black and white print,image/jpg,Image;StillImage,"Digital image, University of Idaho Library, 2015.",,"Falls Creek, Shoshone County, Idaho, United States",http://www.geonames.org/5592790/falls-creek.html,47.7461,-116.0209,http://digital.lib.uidaho.edu:80/cdm/ref/collection/whitepine/id/82,82Holt Tractor Loaded with Logs,,"Tractor ready to pull a load of logs to the river, Ray Rauch operation near Newport, Washington. Holt Caterpillar """"60"""" Tractor pulling  """"bummer"""", two wagons and three trailers loaded with a total 22,270 board feet of logs. Ray Rauch is the man wearing a vest. Courtesy Lester M. Tarbet.",1/1/13,,logs (wood); crawler tractors; group portraits; draft horses;,"PG 6069 MG 69, White Pine: King of Many Waters Collection",Mountain Press Publishing Company,WPKOMW p. 131. Also print,69_2_B-40,black and white film copy negative,image/jpg,Image;StillImage,"Digital image, University of Idaho Library, 2015.",,"Newport, Pend Oreille County, Washington, United States",http://www.geonames.org/5804694/newport.html,48.1819,-117.0354,http://digital.lib.uidaho.edu:80/cdm/ref/collection/whitepine/id/83,83Sleigh Loaded with Logs,,"Sleigh load of logs drawn by horses. Ray Rauch operation near Newport, Washington. Load is a total of 12,400 board feet log measure) Men are left to right: Walt Cooley, Sean Cooley, Seifers Golt, and Ray R. Rauch. The haul was 6 miles and was run twice a day. It cost $2.75 per mile to mill. Courtesy Lester M. Tarbet.",1/1/11,,logs (wood); draft horses; snow; winter; group portraits; sleighs;,"PG 6069 MG 69, White Pine: King of Many Waters Collection",Mountain Press Publishing Company,WPKOMW p. 109. Also print,69_2_B-41,black and white film copy negative,image/jpg,Image;StillImage,"Digital image, University of Idaho Library, 2015.",,"Newport, Pend Oreille County, Washington, United States",http://www.geonames.org/5804694/newport.html,48.1819,-117.0354,http://digital.lib.uidaho.edu:80/cdm/ref/collection/whitepine/id/84,84Flume Crew Separating Logs,,"Crew separating logs at the Rose Lake Lumber Company flume, Falls Creek. Courtesy of Tom Reed.",1/1/25,,flumes; log (wood); blue collar workers;,"PG 6069 MG 69, White Pine: King of Many Waters Collection",Mountain Press Publishing Company,WPKOMW p. 118,69_2_B-42,black and white print,image/jpg,Image;StillImage,"Digital image, University of Idaho Library, 2015.",,"Falls Creek, Shoshone County, Idaho, United States",http://www.geonames.org/5592790/falls-creek.html,47.7461,-116.0209,http://digital.lib.uidaho.edu:80/cdm/ref/collection/whitepine/id/85,85Pack String,,"Kirtly & Stone mule pack string loaded with hay, 20 miles NE of Prichard, Idaho. The pack train is headed to Rose Lake. According to Dick Reed this was either the Falls Creek camp 2 or 3 of the Winton Lumber Company. Men are left to right: Bobby Sears, Bob Conners (packer in the 10 gallon hat), and an unidentified man.",1/1/25,,mules (mammals); hay;,"PG 6069 MG 69, White Pine: King of Many Waters Collection",Mountain Press Publishing Company,WPKOMW p. 105,69_2_B-43,black and white print,image/jpg,Image;StillImage,"Digital image, University of Idaho Library, 2015.",,"Falls Creek, Shoshone County, Idaho, United States",http://www.geonames.org/5592790/falls-creek.html,47.7461,-116.0209,http://digital.lib.uidaho.edu:80/cdm/ref/collection/whitepine/id/86,86Marianne Hensley,,"Marianne Hensley, Spirit Lake, helping on logging operations which she does regularly with her husband. Courtesy of Mrs. Hensley.",1/1/25,,lumbermen; women; log (wood); draft horses;,"PG 6069 MG 69, White Pine: King of Many Waters Collection",Mountain Press Publishing Company,WPKOMW p. 158,69_2_B-44,black and white print,image/jpg,Image;StillImage,"Digital image, University of Idaho Library, 2015.",,"Spirit Lake, Kootenai County, Idaho, United States",http://www.geonames.org/5608388/spirit-lake.html,47.9671,-116.8739,http://digital.lib.uidaho.edu:80/cdm/ref/collection/whitepine/id/87,87Falls Creek Flume,,Flume on Falls Creek.,1/1/25,,flumes;,"PG 6069 MG 69, White Pine: King of Many Waters Collection",Mountain Press Publishing Company,,69_2_I-45,black and white print,image/jpg,Image;StillImage,"Digital image, University of Idaho Library, 2015.",,"Falls Creek, Shoshone County, Idaho, United States",http://www.geonames.org/5592790/falls-creek.html,47.7461,-116.0209,http://digital.lib.uidaho.edu:80/cdm/ref/collection/whitepine/id/88,88Chute meets Flume,,Neil Fullerton standing next to the Mica Creek trailing chute. This is where the chute landing met the Mica Creek trailing flume. Beginning of flume in background. St. Joe National Forest. Courtesy of Neil Fullerton.,9/22/39,,portraits; flumes; chutes; log (wood);,"PG 6069 MG 69, White Pine: King of Many Waters Collection",Mountain Press Publishing Company,WPKOMW p. 113. Also print,69_2_B-46,black and white negative,image/jpg,Image;StillImage,"Digital image, University of Idaho Library, 2015.",,"Mica Creek, Shoshone County, Idaho, United States",http://www.geonames.org/5600736/mica-creek.html,47.2686,-116.1363,http://digital.lib.uidaho.edu:80/cdm/ref/collection/whitepine/id/90,90Brickle Creek Flume,,"Logs stacked on log deck and Brickle Creek flume of the Panhandle Lumber Company. Brickle Creek is west of Spirit Lake. Courtesy of Mrs. Richard E. Ferrell (widow of the noted North Idaho lumberjack preacher) Spokane, Washington.",1/1/25,yes,flumes; log (wood);,"PG 6069 MG 69, White Pine: King of Many Waters Collection",Mountain Press Publishing Company,WPKOMW p. 117. Also print,69_2_B-47,black and white film copy negative,image/jpg,Image;StillImage,"Digital image, University of Idaho Library, 2015.",,"Brickel Creek, Spokane County, Washington, United States",http://www.geonames.org/5788093/brickel-creek.html,47.9285,-116.9887,http://digital.lib.uidaho.edu:80/cdm/ref/collection/whitepine/id/91,91Mica Creek Trailing Chute,,Neil Fulleron at the Mica Creek Trailing Chute. This is where the chute landing met up with the Mica Creek Flume. Beginning of Flume can be seen in the background. Saint Joe National Forest.,9/22/39,,portraits; flumes; chutes; log (wood);,"PG 6069 MG 69, White Pine: King of Many Waters Collection",Mountain Press Publishing Company,,69_2_I-48,black and white negative,image/jpg,Image;StillImage,"Digital image, University of Idaho Library, 2015.",,"Mica Creek, Shoshone County, Idaho, United States",http://www.geonames.org/5600736/mica-creek.html,47.2686,-116.1363,http://digital.lib.uidaho.edu:80/cdm/ref/collection/whitepine/id/92,92Brickle Creek Flume,,"Brickle Creek flume in operation, Panhandle Lumber Company. West of Spirit Lake, Idaho. This photo is from an old post card. Courtesy of Mrs. Richard E. Ferrell, Spokane, Washington.",1/1/24,yes,flumes; log (wood);,"PG 6069 MG 69, White Pine: King of Many Waters Collection",Mountain Press Publishing Company,WPKOMW p. 118. Also print,69_2_B-49,black and white film copy negative,image/jpg,Image;StillImage,"Digital image, University of Idaho Library, 2015.",,"Brickel Creek, Spokane County, Washington, United States",http://www.geonames.org/5788093/brickel-creek.html,47.9285,-116.9887,http://digital.lib.uidaho.edu:80/cdm/ref/collection/whitepine/id/93,93Fred Herrick Flume,Clarence C. Strong,Milwaukee Lumber Co. flume on Benewah Creek 50 years after construction (built in 1916).,1/1/66,,flumes; portraits;,"PG 6069 MG 69, White Pine: King of Many Waters Collection",Mountain Press Publishing Company,WPKOMW p. 86,69_2_B-50,black and white print,image/jpg,Image;StillImage,"Digital image, University of Idaho Library, 2015.",,"Benewah Creek, Benewah County, Idaho, United States",http://www.geonames.org/5585305/benewah-creek.html,47.2505,-116.7644,http://digital.lib.uidaho.edu:80/cdm/ref/collection/whitepine/id/94,94Skookum Creek Flume,K.D. Swan,"From chute and rollway to flume, Winton Lumber Company on Skookum Creek. Credit to the U.S.D.A. Forest Service.",1/1/24,,flumes; log (wood); blue collar workers;,"PG 6069 MG 69, White Pine: King of Many Waters Collection",Mountain Press Publishing Company,WPKOMW p. 116,69_2_B-51,black and white print,image/jpg,Image;StillImage,"Digital image, University of Idaho Library, 2015.",,"Skookum Creek, Kootenai County, Idaho, United States",http://www.geonames.org/5607475/skookum-creek.html,47.7408,-116.4745,http://digital.lib.uidaho.edu:80/cdm/ref/collection/whitepine/id/95,95Leiberg Creek Flume,W.C. Lowdermilk,"Rolling logs into Leiberg Creek flume, Little North Fork Coeur d'Alene River, Coeur d'Alene National Forest. Credit to the U.S.D.A. Forest Service.",7/1/20,,flumes; log (wood); blue collar workers;,"PG 6069 MG 69, White Pine: King of Many Waters Collection",Mountain Press Publishing Company,WPKOMW p. 116,69_2_B-52,black and white print,image/jpg,Image;StillImage,"Digital image, University of Idaho Library, 2015.",,"Leiberg Creek, Kootenai County, Idaho, United States",http://www.geonames.org/5598453/leiberg-creek.html,47.715,-116.3825,http://digital.lib.uidaho.edu:80/cdm/ref/collection/whitepine/id/96,96Log Drive,Philip Neff,Log drive on Coeur d'Alene River. Drivers working on a center. Photo credit to the U.S.D.A. Forest Service.,7/18/21,,log (wood); blue collar workers; rivers;,"PG 6069 MG 69, White Pine: King of Many Waters Collection",Mountain Press Publishing Company,,69_2_I-53,black and white print,image/jpg,Image;StillImage,"Digital image, University of Idaho Library, 2015.",,"North Fork Coeur d'Alene River, Shoshone County, Idaho, United States",http://www.geonames.org/5602355/north-fork-coeur-d-alene-river.html,47.5645,-116.3138,http://digital.lib.uidaho.edu:80/cdm/ref/collection/whitepine/id/97,97"Sanders, Idaho",,"A view of the town of Sanders, Idaho. Courtesy of Mrs. Day of New Sanders, Idaho.",1/1/05,yes,towns;,"PG 6069 MG 69, White Pine: King of Many Waters Collection",Mountain Press Publishing Company,,69_2_I-54,black and white print,image/jpg,Image;StillImage,"Digital image, University of Idaho Library, 2015.",,"Sanders, Benewah County, Idaho, United States",http://www.geonames.org/5606410/sanders.html,47.1066,-116.796,http://digital.lib.uidaho.edu:80/cdm/ref/collection/whitepine/id/98,98Driving Cranberry and Marble Creeks,Charles K. McHarg,"Logs at the junction of Cranberry Creek and Marble Creek, St. Joe National Forest. Credit U.S.D.A. Forest Service.",6/18/23,,log (wood); rivers;,"PG 6069 MG 69, White Pine: King of Many Waters Collection",Mountain Press Publishing Company,WPKOMW p. 56,69_2_B-55,black and white print,image/jpg,Image;StillImage,"Digital image, University of Idaho Library, 2015.",,"Cranberry Creek, Shoshone County, Idaho, United States",http://www.geonames.org/5590071/cranberry-creek.html,47.1292,-116.1012,http://digital.lib.uidaho.edu:80/cdm/ref/collection/whitepine/id/99,99"Tugboat """"Coeur d'Alene""""",Neil Fullerton,Tugboat towing logs on St. Joe River above St. Maries towards Coeur d'Alene.,5/8/41,,log (wood); rivers; tugboats;,"PG 6069 MG 69, White Pine: King of Many Waters Collection",Mountain Press Publishing Company,,69_2_B-13,black and white negative,image/jpg,Image;StillImage,"Digital image, University of Idaho Library, 2015.",,"Cottonwood Point, Benewah County, Idaho, United States",http://www.geonames.org/5589775/cottonwood-point.html,47.3317,-116.6177,http://digital.lib.uidaho.edu:80/cdm/ref/collection/whitepine/id/100,100Sleigh Loaded with Logs,,"Joe Brown logging operation at Sanders, Idaho. Team of horses pulling a """"go-devil"""" or a sled. Courtesy of Mrs. Day of Sanders, ID.",1/1/05,yes,sleds; draft horses; group portraits; log (wood); snow; winter;,"PG 6069 MG 69, White Pine: King of Many Waters Collection",Mountain Press Publishing Company,,69_2_I-56,black and white print,image/jpg,Image;StillImage,"Digital image, University of Idaho Library, 2015.",,"Sanders, Benewah County, Idaho, United States",http://www.geonames.org/5606410/sanders.html,47.1066,-116.796,http://digital.lib.uidaho.edu:80/cdm/ref/collection/whitepine/id/101,101Sleigh Loaded with Logs,,"Joe Brown logging operation at Sanders, Idaho. Woman and children on sleigh load of logs, left to right: Mrs. Joe Brown, Esther Brown, and Roy Brown. (ALS Esther St. George to Clarence C. Strong on 8/15/1968.) Courtesy of his daughter (presumably Esther St. George), Sanders, Idaho.",1/1/05,yes,sleds; draft horses; group portraits; log (wood); snow; winter; children;,"PG 6069 MG 69, White Pine: King of Many Waters Collection",Mountain Press Publishing Company,,69_2_I-57,black and white film copy negative,image/jpg,Image;StillImage,"Digital image, University of Idaho Library, 2015.",,"Sanders, Benewah County, Idaho, United States",http://www.geonames.org/5606410/sanders.html,47.1066,-116.796,http://digital.lib.uidaho.edu:80/cdm/ref/collection/whitepine/id/102,102Sleigh Loaded with Logs,,"Sleigh load of logs. Joe Brown logging operation at Sanders, Idaho. Two visible men are left to right: Joe Brown and John Jordan. Child is Roy Brown. (ALS Esther St. George to Clarence C. Strong on 8-15-68.)",1/1/05,yes,sleds; draft horses; group portraits; log (wood); snow; winter; children; lumbermen;,"PG 6069 MG 69, White Pine: King of Many Waters Collection",Mountain Press Publishing Company,,69_2_I-59,black and white print,image/jpg,Image;StillImage,"Digital image, University of Idaho Library, 2015.",,"Sanders, Benewah County, Idaho, United States",http://www.geonames.org/5606410/sanders.html,47.1066,-116.796,http://digital.lib.uidaho.edu:80/cdm/ref/collection/whitepine/id/103,103Logs Stored Along St. Joe.,Paul M. Elder,Logs stored in slough along St. Joe River.,1/1/08,,log (wood); rivers; sloughs;,"PG 6069 MG 69, White Pine: King of Many Waters Collection",Mountain Press Publishing Company,WPKOMW p. 128,69_2_B-60,black and white print,image/jpg,Image;StillImage,"Digital image, University of Idaho Library, 2015.",,"Rochat Creek, Benewah County, Idaho, United States",http://www.geonames.org/5605533/rochat-creek.html,47.3304,-116.4425,http://digital.lib.uidaho.edu:80/cdm/ref/collection/whitepine/id/104,104Loaded Logging Truck,Sidney Streator,"Logging truck loaded with white pine and crew. Winton Lumber Company, Gibbs, Idaho. Courtesy of Northern Idaho Junior College.",1/1/35,yes,log (wood); group portraits; trucks; blue collar workers;,"PG 6069 MG 69, White Pine: King of Many Waters Collection",Mountain Press Publishing Company,WPKOMW p. 132,69_2_B-58,black and white print,image/jpg,Image;StillImage,"Digital image, University of Idaho Library, 2015.",,"Gibbs, Kootenai County, Idaho, United States",http://www.geonames.org/5594007/gibbs.html,47.69,-116.8025,http://digital.lib.uidaho.edu:80/cdm/ref/collection/whitepine/id/105,105Al B. Lafferty,Kyle Walker,"Al B. Lafferty, longtime owner and manager of Lafferty Transportation Company.",1/1/55,yes,portraits; offices (work spaces); directors (administrators);,"PG 6069 MG 69, White Pine: King of Many Waters Collection",Mountain Press Publishing Company,WPKOMW p. 126,69_2_B-61,black and white print,image/jpg,Image;StillImage,"Digital image, University of Idaho Library, 2015.",,"Kootenai County, Idaho, United States",http://www.geonames.org/5597922/kootenai-county.html,47.6746,-116.7,http://digital.lib.uidaho.edu:80/cdm/ref/collection/whitepine/id/106,106Hand Logged Forest,Philip Neff,"Hand logging operation of the Hedlund Lumber Company, Big Grizzly Creek, Coeur d'Alene National Forest. Photo credit to the U.S.D.A. Forest Service.",7/18/21,,forests (plant communities); log (wood); logging;,"PG 6069 MG 69, White Pine: King of Many Waters Collection",Mountain Press Publishing Company,,69_2_I-62,black and white print,image/jpg,Image;StillImage,"Digital image, University of Idaho Library, 2015.",,"Boundary Creek, Shoshone County, Idaho, United States",http://www.geonames.org/5586651/boundary-creek.html,47.8037,-116.3296,http://digital.lib.uidaho.edu:80/cdm/ref/collection/whitepine/id/107,107Sleigh Loaded with Logs,A. B. Curtis,"Sleigh load of logs pulled by tractor or """"cat"""". Clearwater Timber Company, Headquarters, Idaho.",1/1/32,,log (wood); sleighs; snow; winter;,"PG 6069 MG 69, White Pine: King of Many Waters Collection",Mountain Press Publishing Company,WPKOMW p. 110,69_2_B-63,black and white print,image/jpg,Image;StillImage,"Digital image, University of Idaho Library, 2015.",,"Headquarters, Clearwater County, Idaho, United States",http://www.geonames.org/5595392/headquarters.html,46.6418,-115.811,http://digital.lib.uidaho.edu:80/cdm/ref/collection/whitepine/id/108,108Horse Skidding Logs,W. E. Steuerwald,"Horse skidding logs on Stony Creek, Kaniksu National Forest. Taken in August. Photo Credit to the U.S. Forest Service.",1/1/50,,logging; log (wood); draft horses; blue collar workers; lumbermen;,"PG 6069 MG 69, White Pine: King of Many Waters Collection",Mountain Press Publishing Company,,69_2_I-65,black and white print,image/jpg,Image;StillImage,"Digital image, University of Idaho Library, 2015.",,"Stony Creek, Shoshone County, Idaho, United States",http://www.geonames.org/5609023/stony-creek.html,47.875,-116.1062,http://digital.lib.uidaho.edu:80/cdm/ref/collection/whitepine/id/109,109Ohio Match Company Log Train,Charles K. McHarg,The log train is being pulled by a Heisler locomotive on a section of the Burnt Cabin Creek Railway. Photo is credited to the U.S.D.A. Forest Service.,1/1/30,,railroad (infrastructure); steam locomotives; flatcars; log (wood); snow;,"PG 6069 MG 69, White Pine: King of Many Waters Collection",Mountain Press Publishing Company,WPKOMW p. 123,69_2_B-4,black and white print,image/jpg,Image;StillImage,"Digital image, University of Idaho Library, 2015.",,"Burnt Cabin Mine, Kootenai County, Idaho, United States",http://www.geonames.org/5587414/burnt-cabin-mine.html,47.7688,-116.5778,http://digital.lib.uidaho.edu:80/cdm/ref/collection/whitepine/id/111,111"Steamboat """"Georgie Oakes""""",,"Steamboat """"Georgie Oakes"""" and crew. Refueling near Harrison, Idaho. Presented by """"Trux"""" Truskowsky.",1/1/10,Yes,rivers; group portraits; steamboats;,"PG 6069 MG 69, White Pine: King of Many Waters Collection",Mountain Press Publishing Company,WPKOMW p. 23,69_2_B-66,black and white print,image/jpg,Image;StillImage,"Digital image, University of Idaho Library, 2015.",,"Harrison, Kootenai County, Idaho, United States",http://www.geonames.org/5595198/harrison.html,47.4545,-116.7856,http://digital.lib.uidaho.edu:80/cdm/ref/collection/whitepine/id/112,112White Pine Stand,Sidney Streator,"Stand of white pine timber near Cascade Creek, Coeur d'Alene National Forest. Operation of Winton Lumber Company, Gibbs, Idaho.",1/1/27,,white pine (wood); forest plant communities);,"PG 6069 MG 69, White Pine: King of Many Waters Collection",Mountain Press Publishing Company,WPKOMW p. xii,69_2_B-64,black and white print,image/jpg,Image;StillImage,"Digital image, University of Idaho Library, 2015.",,"Cascade Creek, Kootenai County, Idaho, United States",http://www.geonames.org/5588167/cascade-creek.html,47.7769,-116.478,http://digital.lib.uidaho.edu:80/cdm/ref/collection/whitepine/id/113,113Jackson Lumber Harvester,Idaho State Forestry Division,"Jackson lumber harvester in Boundary County, Idaho.",1/1/48,,logging; log (wood); blue collar workers; lumbermen;,"PG 6069 MG 69, White Pine: King of Many Waters Collection",Mountain Press Publishing Company,,69_2_I-70,black and white print,image/jpg,Image;StillImage,"Digital image, University of Idaho Library, 2015.",,"Bald Eagle Mountain, Boundary County, Idaho, United States",http://www.geonames.org/5584534/bald-eagle-mountain.html,48.5151,-116.2674,http://digital.lib.uidaho.edu:80/cdm/ref/collection/whitepine/id/117,117Grant Lumber Company Lumberyard,,"Grant Lumber Company, St. Maries, Idaho (misidentified as C.W. Russell Sawmill in White Pine King of Many Waters). View of the lumber yard and its employees. From Souvenir of St. Maries by Straffin and Day (1911).",1892-01-01,,lumberyard (stores); blue collar workers; draft horses;,"PG 6069 MG 69, White Pine: King of Many Waters Collection",Mountain Press Publishing Company,WPKOMW p. 20. Also film printing negative,69_2_B-71,black and white print,image/jpg,Image;StillImage,"Digital image, University of Idaho Library, 2015.",,"Saint Maries, Benewah County, Idaho, United States",http://www.geonames.org/5606232/saint-maries.html,47.3144,-116.563,http://digital.lib.uidaho.edu:80/cdm/ref/collection/whitepine/id/118,118Ohio Match Company Sawmill,K.D. Swan,"Ohio Match Company sawmill, Huetter, Idaho. Credit to the U.S.D.A. Forest Service.",1/1/28,,ponds (water); sawmills; lumberyard (stores);,"PG 6069 MG 69, White Pine: King of Many Waters Collection",Mountain Press Publishing Company,WPKOMW p. 60,69_2_B-73,black and white print,image/jpg,Image;StillImage,"Digital image, University of Idaho Library, 2015.",,"Huetter, Kootenai County, Idaho, United States",http://www.geonames.org/5596312/huetter.html,47.7033,-116.8503,http://digital.lib.uidaho.edu:80/cdm/ref/collection/whitepine/id/119,119Athol Lumber Company,,"Athol Lumber Company mill, Athol, Idaho. From a postcard.",1/1/11,Yes,sawmills; lumberyards (stores);,"PG 6069 MG 69, White Pine: King of Many Waters Collection",Mountain Press Publishing Company,,69_2_I-74,black and white film copy negative,image/jpg,Image;StillImage,"Digital image, University of Idaho Library, 2015.",,"Athol, Kootenai County, Idaho, United States",http://www.geonames.org/5584330/athol.html,47.948,-116.7072,http://digital.lib.uidaho.edu:80/cdm/ref/collection/whitepine/id/120,120Idaho Lumber and Manufacturing Company Sawmill,,"Idaho Lumber and Manufacturing Company sawmill, Post Falls, Idaho. Courtesy Curtis Whitaker, Post Falls, Idaho.",1900-01-01,Yes,ponds (water); sawmills;,"PG 6069 MG 69, White Pine: King of Many Waters Collection",Mountain Press Publishing Company,WPKOMW p. 74. Also print,69_2_B-72,black and white film copy negative,image/jpg,Image;StillImage,"Digital image, University of Idaho Library, 2015.",,"Post Falls, Kootenai County, Idaho, United States",http://www.geonames.org/5604353/post-falls.html,47.7174,-116.951,http://digital.lib.uidaho.edu:80/cdm/ref/collection/whitepine/id/121,121Cameron Lumber Company Sawmill,,"Cameron Lumber Company plant and employees at Harrison, Idaho. Courtesy Bert Russell, Harrison, Idaho.",1901-01-01,,ponds (water); sawmills; lumberyard (stores); railroad (infrastructure); freight cars;,"PG 6069 MG 69, White Pine: King of Many Waters Collection",Mountain Press Publishing Company,WPKOMW p. 72,69_2_B-75,black and white print,image/jpg,Image;StillImage,"Digital image, University of Idaho Library, 2015.",,"Harrison, Kootenai County, Idaho, United States",http://www.geonames.org/5595198/harrison.html,47.4544,-116.784,http://digital.lib.uidaho.edu:80/cdm/ref/collection/whitepine/id/122,122Loaded Logging Truck,K.D. Swan,"Truck load of logs, Kaniksu National Forest. Taken in August. U.S. Forest Service photo.",1/1/57,,trucks; log (wood);,"PG 6069 MG 69, White Pine: King of Many Waters Collection",Mountain Press Publishing Company,,69_2_I-67,black and white print,image/jpg,Image;StillImage,"Digital image, University of Idaho Library, 2015.",,"Fall Creek, Bonner County, Idaho, United States",http://www.geonames.org/5592730/fall-creek.html,48.3392,-116.1665,http://digital.lib.uidaho.edu:80/cdm/ref/collection/whitepine/id/123,123"Potlatch Forests Incorporated, Rutledge Unit",Clarence C. Strong,"Rutledge Unit of Potlatch Forests, Incorporated, Coeur d'Alene, Idaho.",1/1/68,,sawmills; lumberyards (stores); expressway;,"PG 6069 MG 69, White Pine: King of Many Waters Collection",Mountain Press Publishing Company,,69_2_I-77,black and white print,image/jpg,Image;StillImage,"Digital image, University of Idaho Library, 2015.",,"Coeur d'Alene, Kootenai County, Idaho, United States",http://www.geonames.org/5589173/coeur-d-alene.html,47.6776,-116.7925,http://digital.lib.uidaho.edu:80/cdm/ref/collection/whitepine/id/124,124