title,creator,description,date,Date Approximate,subjects,source,publisher,book-relationship,identifier-original,format-original,format,type,rights,language,location,geonames,latitude,longitude,link,object-idSt. Maries Lumber Company Sawmill,Paul M. Elder,"St. Maries Lumber Company sawmill. Current owner at this time was Lawrence Pugh though previous owners are also listed on the back of the photo: Mike Bogle, W.W. Kroll -1913 (son Charles), Fred Herrick -1920, and G.A. Rogers. Courtesy Paul M. Elder.",1/1/52,,sawmills; log (wood); rivers;,"PG 6069 MG 69, White Pine: King of Many Waters Collection",Mountain Press Publishing Company,WPKOMW p. 69,69_2_B-78,black and white print,image/jpg,Image;StillImage,"Digital image, University of Idaho Library, 2015.",,"Saint Maries, Benewah County, Idaho, United States",http://www.geonames.org/5606232/saint-maries.html,47.3143,-116.5617,http://digital.lib.uidaho.edu:80/cdm/ref/collection/whitepine/id/125,125Boarding House and Sawmill,,"Charles W. Russell boarding house & sawmill, Harrison, Idaho (misidentified as Grant Lumber Company Lumberyard in White Pine King of Many Waters). Courtesy of Bert Russell (grandson), Harrison, Idaho.",1900-01-01,,ponds (water); sawmills; lumberyard (stores); railroad (infrastructure); boardinghouses;,"PG 6069 MG 69, White Pine: King of Many Waters Collection",Mountain Press Publishing Company,WPKOMW p. 18,69_2_B-76,black and white print,image/jpg,Image;StillImage,"Digital image, University of Idaho Library, 2015.",,"Harrison, Kootenai County, Idaho, United States",http://www.geonames.org/5595198/harrison.html,47.4544,-116.784,http://digital.lib.uidaho.edu:80/cdm/ref/collection/whitepine/id/126,126B.R. Lewis Lumber Company Sawmill,Paul M. Elder,"B.R. Lewis Lumber Company, Coeur d'Alene, Idaho.",1/1/08,,sawmills; log (wood); rivers; lumberyard (stores);,"PG 6069 MG 69, White Pine: King of Many Waters Collection",Mountain Press Publishing Company,,69_2_I-79,black and white print,image/jpg,Image;StillImage,"Digital image, University of Idaho Library, 2015.",,"Coeur d'Alene, Kootenai County, Idaho, United States",http://www.geonames.org/5589173/coeur-d-alene.html,47.6776,-116.7925,http://digital.lib.uidaho.edu:80/cdm/ref/collection/whitepine/id/127,127B.R. Lewis Lumber Company Photo Collage,Paul M. Elder,B.R. Lewis Lumber Company - composite and arrangement of several pictures showing logging operations.,1/1/08,,composite views; photographs; sawmills; log (wood);,"PG 6069 MG 69, White Pine: King of Many Waters Collection",Mountain Press Publishing Company,,69_2_I-80,black and white print,image/jpg,Image;StillImage,"Digital image, University of Idaho Library, 2015.",,"Coeur d'Alene, Kootenai County, Idaho, United States",http://www.geonames.org/5589173/coeur-d-alene.html,47.6776,-116.7925,http://digital.lib.uidaho.edu:80/cdm/ref/collection/whitepine/id/128,128B.R. Lewis Lumber Company Sawmill,Paul M. Elder,"B.R. Lewis Lumber Company sawmill, Coeur d'Alene, Idaho.",1/1/08,,sawmills; log (wood); rivers;,"PG 6069 MG 69, White Pine: King of Many Waters Collection",Mountain Press Publishing Company,WPKOMW p. 63,69_2_B-81,black and white print,image/jpg,Image;StillImage,"Digital image, University of Idaho Library, 2015.",,"Coeur d'Alene, Kootenai County, Idaho, United States",http://www.geonames.org/5589173/coeur-d-alene.html,47.6776,-116.7925,http://digital.lib.uidaho.edu:80/cdm/ref/collection/whitepine/id/129,129Ohio Match Company Sawmill,Paul M. Elder,"Ohio Match Company sawmill, Huetter, Idaho. (Now Diamond International)",1/1/46,,sawmills; log (wood); rivers; lumberyard (stores); incinerators;,"PG 6069 MG 69, White Pine: King of Many Waters Collection",Mountain Press Publishing Company,,69_2_I-82,black and white print,image/jpg,Image;StillImage,"Digital image, University of Idaho Library, 2015.",,"Huetter, Kootenai County, Idaho, United States",http://www.geonames.org/5596312/huetter.html,47.7035,-116.8505,http://digital.lib.uidaho.edu:80/cdm/ref/collection/whitepine/id/130,130Coeur d'Alene Lumber Company Sawmill,Paul M. Elder,Coeur d'Alene Lumber Company sawmill and employees.,1/1/09,,lumberyards (stores); group portraits; blue collar workers;  draft horses; railroad (infrastructure); flatcars;,"PG 6069 MG 69, White Pine: King of Many Waters Collection",Mountain Press Publishing Company,,69_2_I-83,black and white print,image/jpg,Image;StillImage,"Digital image, University of Idaho Library, 2015.",,"Coeur d'Alene, Kootenai County, Idaho, United States",http://www.geonames.org/5589173/coeur-d-alene.html,47.6776,-116.7925,http://digital.lib.uidaho.edu:80/cdm/ref/collection/whitepine/id/131,131Coeur d'Alene Lumber Company Sawmill,,Coeur d'Alene Lumber Company sawmill.,1/1/05,,sawmills; lumberyards (stores); incinerators;,"PG 6069 MG 69, White Pine: King of Many Waters Collection",Mountain Press Publishing Company,,69_2_I-84,black and white print,image/jpg,Image;StillImage,"Digital image, University of Idaho Library, 2015.",,"Coeur d'Alene, Kootenai County, Idaho, United States",http://www.geonames.org/5589173/coeur-d-alene.html,47.6776,-116.7925,http://digital.lib.uidaho.edu:80/cdm/ref/collection/whitepine/id/132,132Post Falls Lumber Company Sawmill,Paul M. Elder,"Post Falls Lumber Company sawmill, Post Falls, Idaho.",1/1/46,,sawmills; dams (hydraulic structures); cascades (water features);,"PG 6069 MG 69, White Pine: King of Many Waters Collection",Mountain Press Publishing Company,WPKOMW p. 76,69_2_B-85,black and white print,image/jpg,Image;StillImage,"Digital image, University of Idaho Library, 2015.",,"Post Falls, Kootenai County, Idaho, United States",http://www.geonames.org/5604353/post-falls.html,47.7181,-116.9509,http://digital.lib.uidaho.edu:80/cdm/ref/collection/whitepine/id/133,133Trailing by Steam Donkey,,A steam donkey trailing logs in a chute. Logging fire damaged timber in St. Joe-Big Creek area on a Fred Herrick operation. Courtesy of the St. Maries Gazette-Record.,1/1/13,,chutes; log (wood); steam turbines;,"PG 6069 MG 69, White Pine: King of Many Waters Collection",Mountain Press Publishing Company,WPKOMW p. 39,69_2_B-68,black and white print,image/jpg,Image;StillImage,"Digital image, University of Idaho Library, 2015.",,"East Fork Big Creek, Latah County, Idaho, United States",http://www.geonames.org/5591912/east-fork-big-creek.html,46.9906,-116.7001,http://digital.lib.uidaho.edu:80/cdm/ref/collection/whitepine/id/134,134Frederick Post Water-Powered Sawmill,,"Frederick Post's first water-powered sawmill and employees, Post Falls, Idaho. Courtesy Paul M. Elder.",1890-01-01,,sawmills; dams (hydraulic structures); cascades (water features); group portraits; blue collar workers;,"PG 6069 MG 69, White Pine: King of Many Waters Collection",Mountain Press Publishing Company,WPKOMW p. 14,69_2_B-86,black and white print,image/jpg,Image;StillImage,"Digital image, University of Idaho Library, 2015.",,"Post Falls, Kootenai County, Idaho, United States",http://www.geonames.org/5604353/post-falls.html,47.7181,-116.9509,http://digital.lib.uidaho.edu:80/cdm/ref/collection/whitepine/id/135,135A.W. Post Sawmill and Log Pond,,"A.W. Post mill and log pond, Rathdrum, Idaho. Group portrait on the edge of the log pond, sawmill in background. Courtesy of Mrs. John Post, Coeur d'Alene, Idaho.",1890-01-01,,group portraits; ponds (water); log (wood); draft horses; sawmills;,"PG 6069 MG 69, White Pine: King of Many Waters Collection",Mountain Press Publishing Company,,69_2_I-87,black and white print,image/jpg,Image;StillImage,"Digital image, University of Idaho Library, 2015.",,"Rathdrum, Kootenai County, Idaho, United States",http://www.geonames.org/5553955/rathdrum.html,47.8124,-116.8956,http://digital.lib.uidaho.edu:80/cdm/ref/collection/whitepine/id/136,136A.W. Post and Crew,,"A.W. Post and crew in the Company yard and sawmill, Rathdrum, Idaho. A.W. Post in back 3rd from left. John W. Post in front 4th from left. Courtesy of Mrs. John Post, Coeur d'Alene, Idaho.",1890-01-01,,lumberyard (stores); blue collar workers; group portraits;,"PG 6069 MG 69, White Pine: King of Many Waters Collection",Mountain Press Publishing Company,WPKOMW p. 15,69_2_B-88,black and white print,image/jpg,Image;StillImage,"Digital image, University of Idaho Library, 2015.",,"Rathdrum, Kootenai County, Idaho, United States",http://www.geonames.org/5553955/rathdrum.html,47.8124,-116.8956,http://digital.lib.uidaho.edu:80/cdm/ref/collection/whitepine/id/137,137A.W. Post and Crew,,"A.W. Post and crew in the interior of the sawmill, Rathdrum, Idaho. A.W. Post in back 4th from left and John W. Post in front first on the left. Courtesy of Mrs. John Post, Coeur d'Alene, Idaho.",1890-01-01,,sawmill; blue collar workers; group portraits;,"PG 6069 MG 69, White Pine: King of Many Waters Collection",Mountain Press Publishing Company,,69_2_I-89,black and white print,image/jpg,Image;StillImage,"Digital image, University of Idaho Library, 2015.",,"Rathdrum, Kootenai County, Idaho, United States",http://www.geonames.org/5553955/rathdrum.html,47.8124,-116.8956,http://digital.lib.uidaho.edu:80/cdm/ref/collection/whitepine/id/138,138"Potlatch Forests Incorporated, Rutledge Unit",Western Ways Incorporated,"Aerial view of PFI's (Potlatch Forests Incorporated) Rutledge Unit yard, Coeur d'Alene, Idaho. Credit to Western Ways Incorporated. Roof of largest building reads: """"Coeur D'Alene"""". Side of connected building reads: """"Safety everywhere all the time"""". Courtesy of the Rutledge Unit.",6/30/66,,lumberyard (stores); log (wood); sawmills; lakes (bodies of water); expressways; railroad (infrastructure); aerial photographs; aerial views;,"PG 6069 MG 69, White Pine: King of Many Waters Collection",Mountain Press Publishing Company,WPKOMW p. 66,69_2_B-90,black and white print,image/jpg,Image;StillImage,"Digital image, University of Idaho Library, 2015.",,"Coeur d'Alene, Kootenai County, Idaho, United States",http://www.geonames.org/5589173/coeur-d-alene.html,47.6776,-116.7925,http://digital.lib.uidaho.edu:80/cdm/ref/collection/whitepine/id/139,139Fort Coeur d'Alene Sawmill,,Army sawmill at Fort Coeur d'Alene (Later Fort Sherman). Credit to the Quartermaster General photo number 92-F-63-19 in the National Archives.,1/1/10,yes,sawmills; log (wood);,"PG 6069 MG 69, White Pine: King of Many Waters Collection",Mountain Press Publishing Company,WPKOMW p. 13,69_2_B-91,black and white print,image/jpg,Image;StillImage,"Digital image, University of Idaho Library, 2015.",,"North Idaho College, Kootenai County, Idaho, United States",http://www.geonames.org/5602541/north-idaho-college.html,47.6875,-116.796,http://digital.lib.uidaho.edu:80/cdm/ref/collection/whitepine/id/140,140St. Joe Lumber Company Sawmill,,"St. Joe Lumber Company plant, Harrison, Idaho. Courtesy Bert Russell.",1903-01-01,Yes,sawmills; lakes (bodies of water); railroad (infrastructure); freight cars; boxcars;,"PG 6069 MG 69, White Pine: King of Many Waters Collection",Mountain Press Publishing Company,WPKOMW p. 81,69_2_B-92,black and white print,image/jpg,Image;StillImage,"Digital image, University of Idaho Library, 2015.",,"Harrison, Kootenai County, Idaho, United States",http://www.geonames.org/5595198/harrison.html,47.4544,-116.784,http://digital.lib.uidaho.edu:80/cdm/ref/collection/whitepine/id/141,141Whip Sawing at Lake Bennett,E.A. Hagg,Whipsaw mill in action in wintertime. Credit to the Idaho Historical Society,1890-01-01,Yes,snow; winter; log (wood); pit saws; blue collar workers; lumbermen;,"PG 6069 MG 69, White Pine: King of Many Waters Collection",Mountain Press Publishing Company,WPKOMW p. 10,69_2_B-93,black and white print,image/jpg,Image;StillImage,"Digital image, University of Idaho Library, 2015.",,"Bennett Bay, Kootenai County, Idaho, United States",http://www.geonames.org/5585311/bennett-bay.html,47.6417,-116.7194,http://digital.lib.uidaho.edu:80/cdm/ref/collection/whitepine/id/142,142Frank J. Davies.,,"Frank J. Davies, Secretary and First Manager of Edward Rutledge Timber Company at Coeur d'Alene. Courtesy of Potlatch Forests Incorporated.",1890-01-01,yes,portraits; managers;,"PG 6069 MG 69, White Pine: King of Many Waters Collection",Mountain Press Publishing Company,WPKOMW p. 138. Also print,69_2_B-94,black and white film copy negative,image/jpg,Image;StillImage,"Digital image, University of Idaho Library, 2015.",,"Coeur d'Alene, Kootenai County, Idaho, United States",http://www.geonames.org/5589173/coeur-d-alene.html,47.6776,-116.7925,http://digital.lib.uidaho.edu:80/cdm/ref/collection/whitepine/id/143,143Richard E. (Dick) Ferrell.,,"Reverend """"Dick"""" Richard E. Ferrell. Lumberjack missionary of the Coeur d'Alenes. Dick was also formerly a blacksmith and prize fighter. Courtesy of Mrs. Richard E. Ferrell.",1/1/35,yes,portraits; missionaries; lumbermen; pastors;,"PG 6069 MG 69, White Pine: King of Many Waters Collection",Mountain Press Publishing Company,WPKOMW p. 140. Also print,69_2_B-95,black and white film negative,image/jpg,Image;StillImage,"Digital image, University of Idaho Library, 2015.",,"Coeur d'Alene, Kootenai County, Idaho, United States",http://www.geonames.org/5589173/coeur-d-alene.html,47.6776,-116.7925,http://digital.lib.uidaho.edu:80/cdm/ref/collection/whitepine/id/144,144Bunker Hill Sawmill,,Bunker Hill sawmill 1900 (from Bunker hill Company publication).,1/1/10,yes,sawmills; clippings (information artifacts);,"PG 6069 MG 69, White Pine: King of Many Waters Collection",Mountain Press Publishing Company,,69_2_I-69,black and white print,image/jpg,Image;StillImage,"Digital image, University of Idaho Library, 2015.",,"Bunker Hill Tailings Number Two Dam, Shoshone County, Idaho United States",http://www.geonames.org/5587349/bunker-hill-tailings-number-two-dam.html,47.537,-116.1372,http://digital.lib.uidaho.edu:80/cdm/ref/collection/whitepine/id/145,145Fred Herrick,,"Fred Herrick 1854-1953. Owner of the Coeur d'Alene Mill Company (and the Red Collar Steamship Company) in Coeur d'Alene, Idaho, the Export Lumber Company in Harrison, Idaho, and the Milwaukee and St. Maries Lumber Companies in St. Maries, Idaho. Courtesy of his daughter Mrs. Helen Herrick Malsed Seattle, Washington.",1/1/10,Yes,proprietors; portraits;,"PG 6069 MG 69, White Pine: King of Many Waters Collection",Mountain Press Publishing Company,WPKOMW p. 143.,69_2_B-96,black and white print,image/jpg,Image;StillImage,"Digital image, University of Idaho Library, 2015.",,"Coeur d'Alene, Kootenai County, Idaho, United States",http://www.geonames.org/5589173/coeur-d-alene.html,47.6776,-116.7925,http://digital.lib.uidaho.edu:80/cdm/ref/collection/whitepine/id/146,146George Frederick Jewett Sr.,,"George Frederick (Fritz) Jewett Sr. President of Potlatch Forests Incorporated. Courtesy of Potlatch Forests, Incorporated.",1/1/40,Yes,portraits; directors (administrators);,"PG 6069 MG 69, White Pine: King of Many Waters Collection",Mountain Press Publishing Company,WPKOMW p. 147. Also print,69_2_B-97,black and white film copy negative,image/jpg,Image;StillImage,"Digital image, University of Idaho Library, 2015.",,"Kootenai County, Idaho, United States",http://www.geonames.org/5597922/kootenai-county.html,47.6746,-116.7,http://digital.lib.uidaho.edu:80/cdm/ref/collection/whitepine/id/147,147Walter S. Rosenberry,,"Walter S. Rosenberry at his desk at the Winton Lumber Company of Coeur d'Alene in Gibbs, Idaho. He is the manager of Rose Lake Lumber Company, Winton-Rosenberry Lumber Company at St. Joe, and Winton Lumber Company at Gibbs. Courtesy of Robert (Bob) and Ralph Rosenberry.",1/1/35,Yes,portraits; offices (work spaces); directors (administrators); proprietors;,"PG 6069 MG 69, White Pine: King of Many Waters Collection",Mountain Press Publishing Company,WPKOMW p. 153. Also print,69_2_B-100,black and white film copy negative,image/jpg,Image;StillImage,"Digital image, University of Idaho Library, 2015.",,"Gibbs, Kootenai County, Idaho, United States",http://www.geonames.org/5594007/gibbs.html,47.69,-116.8025,http://digital.lib.uidaho.edu:80/cdm/ref/collection/whitepine/id/150,150Tugboat Towing Logs,,"Brails of logs being towed on Coeur d'Alene River near Dudley, Idaho. Taken in August.",1/1/55,,tugboats; rivers; log (wood);,"PG 6069 MG 69, White Pine: King of Many Waters Collection",Mountain Press Publishing Company,,69_2_I-115,black and white print,image/jpg,Image;StillImage,"Digital image, University of Idaho Library, 2015.",,"Dudley, Kootenai County, Idaho, United States",http://www.geonames.org/5591668/dudley.html,47.5419,-116.4234,http://digital.lib.uidaho.edu:80/cdm/ref/collection/whitepine/id/165,165Tugboat Towing Logs,,"Tugboat towing brails of logs on St. Joe River, St. Maries, Idaho. Taken in Spring. Note log driver walking on logs.",1/1/39,,tugboats; rivers; log (wood);,"PG 6069 MG 69, White Pine: King of Many Waters Collection",Mountain Press Publishing Company,,69_2_I-116,black and white film negative,image/jpg,Image;StillImage,"Digital image, University of Idaho Library, 2015.",,"Saint Maries, Benewah County, Idaho, United States",http://www.geonames.org/5606232/saint-maries.html,47.3144,-116.5624,http://digital.lib.uidaho.edu:80/cdm/ref/collection/whitepine/id/166,166Winton Lumber Company Flume,,"Rearing"""" a flume, Falls Creek. Feeder flume under construction on left. Credit Dick Reed.",1/1/25,yes,log (wood); flumes; blue collar workers;,"PG 6069 MG 69, White Pine: King of Many Waters Collection",Mountain Press Publishing Company,,69_2_I-132,black and white print,image/jpg,Image;StillImage,"Digital image, University of Idaho Library, 2015.",,"Falls Creek, Shoshone County, Idaho, United States",http://www.geonames.org/5592790/falls-creek.html,47.7461,-116.0209,http://digital.lib.uidaho.edu:80/cdm/ref/collection/whitepine/id/183,183Winton Lumber Company Flume,,Water flowing and logs being separated in the Falls Creek flume. Feeder flume under construction on left. Credit Dick Reed.,1/1/25,yes,log (wood); flumes; blue collar workers;,"PG 6069 MG 69, White Pine: King of Many Waters Collection",Mountain Press Publishing Company,,69_2_I-133,black and white print,image/jpg,Image;StillImage,"Digital image, University of Idaho Library, 2015.",,"Falls Creek, Shoshone County, Idaho, United States",http://www.geonames.org/5592790/falls-creek.html,47.7461,-116.0209,http://digital.lib.uidaho.edu:80/cdm/ref/collection/whitepine/id/184,184Tugboat Towing Logs,Neil Fullerton,Tugboat pulling logs from St. Maries River into St. Joe River.,6/6/42,,tugboats; rivers; log (wood); houseboats;,"PG 6069 MG 69, White Pine: King of Many Waters Collection",Mountain Press Publishing Company,,69_2_I-8,black and white negative,image/jpg,Image;StillImage,"Digital image, University of Idaho Library, 2015.",,"Saint Maries River, Benewah County, Idaho, United States",http://www.geonames.org/5606239/saint-maries-river.html,47.3165,-116.5556,http://digital.lib.uidaho.edu:80/cdm/ref/collection/whitepine/id/191,191Whip Sawing at Lake Bennett,E.A. Hagg,Whipsaw mill in action in wintertime. Credit to the Idaho Historical Society,1890-01-01,Yes,snow; winter; log (wood); pit saws; blue collar workers; lumbermen;,"PG 6069 MG 69, White Pine: King of Many Waters Collection",Mountain Press Publishing Company,WPKOMW p. 10,69_2_B-93,black and white print,image/jpg,Image;StillImage,"Digital image, University of Idaho Library, 2015.",,"Bennett Bay, Kootenai County, Idaho, United States",http://www.geonames.org/5585311/bennett-bay.html,47.6417,-116.7194,http://digital.lib.uidaho.edu:80/cdm/ref/collection/whitepine/id/215,215A.C. Morbeck.,,"A.C. Morbeck, Owner, manager, and secretary of several lumber manufacturing plants in the Coeur d'Alenes. His career lasted from 1902-1940. Courtesy of his son Donald (Don) Morbeck, Coeur d'Alene, Idaho.",1/1/30,Yes,portraits; proprietors; directors (administrators);,"PG 6069 MG 69, White Pine: King of Many Waters Collection",Mountain Press Publishing Company,WPKOMW p. 149. Also print,69_2_B-98,black and white film copy negative,image/jpg,Image;StillImage,"Digital image, University of Idaho Library, 2015.",,"Coeur d'Alene, Kootenai County, Idaho, United States",http://www.geonames.org/5589173/coeur-d-alene.html,47.6776,-116.7925,http://digital.lib.uidaho.edu:80/cdm/ref/collection/whitepine/id/221,221Frederick Post,,Frederick Post the namesake of Post Falls and owner of a chain of sawmills in the area.,1900-01-01,Yes,portraits; proprietors; pioneers;,"PG 6069 MG 69, White Pine: King of Many Waters Collection",Mountain Press Publishing Company,WPKOMW p. 151,69_2_B-99,black and white print,image/jpg,Image;StillImage,"Digital image, University of Idaho Library, 2015.",,"Post Falls, Kootenai County, Idaho, United States",http://www.geonames.org/5604353/post-falls.html,47.7181,-116.9509,http://digital.lib.uidaho.edu:80/cdm/ref/collection/whitepine/id/222,222Walter S. Rosenberry,,"Walter S. Rosenberry at his desk at the Winton Lumber Company of Coeur d'Alene in Gibbs, Idaho. He is the manager of Rose Lake Lumber Company, Winton-Rosenberry Lumber Company at St. Joe, and Winton Lumber Company at Gibbs. Courtesy of Robert (Bob) and Ralph Rosenberry.",1/1/35,Yes,portraits; offices (work spaces); directors (administrators); proprietors;,"PG 6069 MG 69, White Pine: King of Many Waters Collection",Mountain Press Publishing Company,WPKOMW p. 153. Also print,69_2_B-100,black and white film copy negative,image/jpg,Image;StillImage,"Digital image, University of Idaho Library, 2015.",,"Gibbs, Kootenai County, Idaho, United States",http://www.geonames.org/5594007/gibbs.html,47.69,-116.8025,http://digital.lib.uidaho.edu:80/cdm/ref/collection/whitepine/id/223,223Sawmill Proprietors and Friends,,"The men are left to right: Emery Wilson, W alter B. Russell, Richard """"Dick"""" Ferrell, R.W. Edminster, Jim Evenden, Howard Drake, and A.B. Lafferty. Taken in April.",1/1/55,,group portraits; directors (administrators); proprietors; lumbermen; missionaries; pastors;,"PG 6069 MG 69, White Pine: King of Many Waters Collection",Mountain Press Publishing Company,WPKOMW p. 155.,69_2_B-101,black and white print,image/jpg,Image;StillImage,"Digital image, University of Idaho Library, 2015.",,"Kootenai County, Idaho, United States",http://www.geonames.org/5597922/kootenai-county.html,47.6746,-116.7,http://digital.lib.uidaho.edu:80/cdm/ref/collection/whitepine/id/225,225Huntington Taylor,,"Huntington Taylor, builder and manager of the Edward Rutledge Timber Company, Coeur d'Alene, Idaho, from 1916-1925. Courtesy of Potlatch Forests, Incorporated.",1/1/26,yes,portraits; directors (administrators);,"PG 6069 MG 69, White Pine: King of Many Waters Collection",Mountain Press Publishing Company,,69_2_I-102,black and white film copy negative,image/jpg,Image;StillImage,"Digital image, University of Idaho Library, 2015.",,"Coeur d'Alene, Kootenai County, Idaho, United States",http://www.geonames.org/5589173/coeur-d-alene.html,47.6776,-116.7925,http://digital.lib.uidaho.edu:80/cdm/ref/collection/whitepine/id/226,226C. Lee Billings,,"C. Lee Billings, general manager of Potlatch Forests, Incorporated (from newspaper). He also previously worked for the Forest Service and the Edward Rutledge Timber Company. Courtesy of Potlatch Forests, Incorporated.",1/1/40,Yes,portraits; directors (administrators); clippings (information artifacts);,"PG 6069 MG 69, White Pine: King of Many Waters Collection",Mountain Press Publishing Company,,69_2_I-103,black and white film copy negative,image/jpg,Image;StillImage,"Digital image, University of Idaho Library, 2015.",,"Kootenai County, Idaho, United States",http://www.geonames.org/5597922/kootenai-county.html,47.6746,-116.7,http://digital.lib.uidaho.edu:80/cdm/ref/collection/whitepine/id/227,227Edward Rutledge,,"Edward Rutledge, Minnesota,  namesake and founder of the Edward Rutledge Timber Company Coeur d'Alene, Idaho. Courtesy of Potlatch Forest, Incorporated.",1900-01-01,Yes,portraits; founders (originators);,"PG 6069 MG 69, White Pine: King of Many Waters Collection",Mountain Press Publishing Company,,69_2_I-104,black and white film copy negative,image/jpg,Image;StillImage,"Digital image, University of Idaho Library, 2015.",,"Coeur d'Alene, Kootenai County, Idaho, United States",http://www.geonames.org/5589173/coeur-d-alene.html,47.6776,-116.7925,http://digital.lib.uidaho.edu:80/cdm/ref/collection/whitepine/id/228,228Perl Bailey,,"Arthur Perl Bailey (from Match Tips, August 1963 Article by Ed Rosenlund).",1/1/63,,portraits; clippings (information artifacts);,"PG 6069 MG 69, White Pine: King of Many Waters Collection",Mountain Press Publishing Company,,69_2_I-105,black and white print,image/jpg,Image;StillImage,"Digital image, University of Idaho Library, 2015.",,"Kootenai County, Idaho, United States",http://www.geonames.org/5597922/kootenai-county.html,47.6746,-116.7,http://digital.lib.uidaho.edu:80/cdm/ref/collection/whitepine/id/229,229Marking Hammer,Clarence C. Strong,Dave Dollar Logging Company log branding hammer. Dave Dollar logging Company logged the Marble Creek and Coeur d'Alene river from 1910-1925.,1/1/68,Yes,log (wood); brands (tools); hammers (tools);,"PG 6069 MG 69, White Pine: King of Many Waters Collection",Mountain Press Publishing Company,WPKOMW p. 120,69_2_B-106,black and white print,image/jpg,Image;StillImage,"Digital image, University of Idaho Library, 2015.",,"Kootenai County, Idaho, United States",http://www.geonames.org/5597922/kootenai-county.html,47.6746,-116.7,http://digital.lib.uidaho.edu:80/cdm/ref/collection/whitepine/id/230,230