title,creator,description,date,Date Approximate,subjects,source,publisher,book-relationship,identifier-original,format-original,format,type,rights,language,location,geonames,latitude,longitude,link,object-idJames D. Miller,,"James D. Miller, 1869-1946, Miller Shingle Mill operator of St. Maries, and 2 grandsons (potentially James and Jerry Miller). Courtesy of Glen Miller, St. Maries, Idaho.",1/1/20,Yes,group portraits; children;,"PG 6069 MG 69, White Pine: King of Many Waters Collection",Mountain Press Publishing Company,,69_2_I-107,black and white print,image/jpg,Image;StillImage,"Digital image, University of Idaho Library, 2015.",,"Kootenai County, Idaho, United States",http://www.geonames.org/5597922/kootenai-county.html,47.6746,-116.7,http://digital.lib.uidaho.edu:80/cdm/ref/collection/whitepine/id/231,231Herman Laumeister Shingle Mill,,"Herman Laumeister Shingle Mill, Harrison, Idaho. Courtesy of Mrs. Frank K. Hildebrand, Harrison, Idaho.",1/1/13,yes,sawmills; railroad (infrastructure); utility poles;,"PG 6069 MG 69, White Pine: King of Many Waters Collection",Mountain Press Publishing Company,,69_2_I-109,black and white film copy negative,image/jpg,Image;StillImage,"Digital image, University of Idaho Library, 2015.",,"Harrison, Kootenai County, Idaho, United States",http://www.geonames.org/5595198/harrison.html,47.4542,-116.7856,http://digital.lib.uidaho.edu:80/cdm/ref/collection/whitepine/id/232,232Day Crew,,"Day crew at Stine Lumber & Shingle Company, St. Maries, Idaho. Manufactured only shingles. James (Jim) D. Miller, owner and manager, bareheaded in the back row. [same unintelligible word] operated many years. Courtesy of Glen Miller, his son.",1/1/15,Yes,group portraits; directors (administrators); proprietors; lumbermen; blue collar workers; shingle;,"PG 6069 MG 69, White Pine: King of Many Waters Collection",Mountain Press Publishing Company,WPKOMW p. 102.Also print,69_2_B-110,black and white film copy negative,image/jpg,Image;StillImage,"Digital image, University of Idaho Library, 2015.",,"Saint Maries, Benewah County, Idaho, United States",http://www.geonames.org/5606232/saint-maries.html,47.3144,-116.5624,http://digital.lib.uidaho.edu:80/cdm/ref/collection/whitepine/id/233,233Sam Avery,,"Sam Avery, old time shingle mill operator at Harrison, Idaho from the 1890's-1915. Courtesy of his grandson Sam Avery Kingston, Idaho.",1900-01-01,Yes,portraits; proprietors; directors (administrators);,"PG 6069 MG 69, White Pine: King of Many Waters Collection",Mountain Press Publishing Company,WPKOMW p. 98. Also print,69_2_B-111,black and white film copy negative,image/jpg,Image;StillImage,"Digital image, University of Idaho Library, 2015.",,"Harrison, Kootenai County, Idaho, United States",http://www.geonames.org/5595198/harrison.html,47.4542,-116.7856,http://digital.lib.uidaho.edu:80/cdm/ref/collection/whitepine/id/234,234Stine Lumber and Shingle Company Sawmill,,"Stine Lumber & Shingle Company, St. Maries, Idaho. Side of boxcars reads: """" Chicago, Milwaukee, and St. Paul"""". Courtesy of Glen Miller, St. Maries, Idaho.",1/1/14,Yes,sawmills; railroad (infrastructure); freight cars; boxcars;,"PG 6069 MG 69, White Pine: King of Many Waters Collection",Mountain Press Publishing Company,,69_2_I-108,black and white film copy negative,image/jpg,Image;StillImage,"Digital image, University of Idaho Library, 2015.",,"Saint Maries, Benewah County, Idaho, United States",http://www.geonames.org/5606232/saint-maries.html,47.3144,-116.5624,http://digital.lib.uidaho.edu:80/cdm/ref/collection/whitepine/id/236,236Herman Laumeister,,"Herman Laumeister, on of the principal shingle and lumber mill operators (shingle mills at Harrison and Coeur d'Alene and a sawmill near Murray, Idaho during the period 1893-1930. Courtesy of his daughter Mrs. Frank Hildebrand Harrison, Idaho.",1/1/15,Yes,portraits; proprietors; directors (administrators);,"PG 6069 MG 69, White Pine: King of Many Waters Collection",Mountain Press Publishing Company,WPKOMW p. 101. Also print,69_2_B-112,black and white film copy negative,image/jpg,Image;StillImage,"Digital image, University of Idaho Library, 2015.",,"Harrison, Kootenai County, Idaho, United States",http://www.geonames.org/5595198/harrison.html,47.4542,-116.7856,http://digital.lib.uidaho.edu:80/cdm/ref/collection/whitepine/id/237,237"Tugboat """"Hercules""""",Neil Fullerton,"Tugboat """"Hercules"""" towing logs down the St. Maries River under the new bridge, St. Maries, Idaho.",6/6/42,,tugboats; rivers; log (wood); bridges (built works); houseboats;,"PG 6069 MG 69, White Pine: King of Many Waters Collection",Mountain Press Publishing Company,,69_2_I-113,black and white print,image/jpg,Image;StillImage,"Digital image, University of Idaho Library, 2015.",,"Saint Maries River, Benewah County, Idaho, United States",http://www.geonames.org/5606239/saint-maries-river.html,47.3169,-116.5548,http://digital.lib.uidaho.edu:80/cdm/ref/collection/whitepine/id/238,238Tugboat Towing Logs,,"Brails of logs being towed on Coeur d'Alene River near Dudley, Idaho. Taken in August.",1/1/55,,tugboats; rivers; log (wood);,"PG 6069 MG 69, White Pine: King of Many Waters Collection",Mountain Press Publishing Company,,69_2_I-115,black and white print,image/jpg,Image;StillImage,"Digital image, University of Idaho Library, 2015.",,"Dudley, Kootenai County, Idaho, United States",http://www.geonames.org/5591668/dudley.html,47.5419,-116.4234,http://digital.lib.uidaho.edu:80/cdm/ref/collection/whitepine/id/239,239"Tugboat """"Coeur d'Alene""""",,"Tugboat """"Coeur d'Alene"""" towing brails of logs on St. Joe River towards Coeur d'Alene Lake. Above St. Maries, Idaho.",5/8/41,,tugboats; rivers; log (wood);,"PG 6069 MG 69, White Pine: King of Many Waters Collection",Mountain Press Publishing Company,,69_2_I-117,black and white film negative,image/jpg,Image;StillImage,"Digital image, University of Idaho Library, 2015.",,"Cottonwood Point, Benewah County, Idaho, United States",http://www.geonames.org/5589775/cottonwood-point.html,47.3317,-116.6177,http://digital.lib.uidaho.edu:80/cdm/ref/collection/whitepine/id/241,241Log Jam,,"Log jam near drawbridge, St. Maries, Idaho.",4/18/38,,log (wood); rivers;,"PG 6069 MG 69, White Pine: King of Many Waters Collection",Mountain Press Publishing Company,,69_2_I-118,black and white film negative,image/jpg,Image;StillImage,"Digital image, University of Idaho Library, 2015.",,"Saint Maries River, Benewah County, Idaho, United States",http://www.geonames.org/5606239/saint-maries-river.html,47.3168,-116.5548,http://digital.lib.uidaho.edu:80/cdm/ref/collection/whitepine/id/242,242Landing in St. Joe River,Neil Fullerton,Unloading logs into St. Joe River at the Snooks Logging Camp.,8/24/38,,log (wood); rivers;,"PG 6069 MG 69, White Pine: King of Many Waters Collection",Mountain Press Publishing Company,,69_2_I-119,black and white film negative,image/jpg,Image;StillImage,"Digital image, University of Idaho Library, 2015.",,"Canyon Creek, Shoshone County, Idaho, United States",http://www.geonames.org/5587997/canyon-creek.html,47.2424,-116.0233,http://digital.lib.uidaho.edu:80/cdm/ref/collection/whitepine/id/243,243Deck of Logs,,Large pile of logs.,,,log (wood);,"PG 6069 MG 69, White Pine: King of Many Waters Collection",Mountain Press Publishing Company,,69_2_I-120,black and white film copy negative,image/jpg,Image;StillImage,"Digital image, University of Idaho Library, 2015.",,"Kootenai County, Idaho, United States",http://www.geonames.org/5597922/kootenai-county.html,47.6746,-116.7,http://digital.lib.uidaho.edu:80/cdm/ref/collection/whitepine/id/244,244Beaver Creek Flume,A.B. Curtis,"Beaver Creek flume of Potlatch Forests, Incorporated.",,,flumes; log (wood);,"PG 6069 MG 69, White Pine: King of Many Waters Collection",Mountain Press Publishing Company,WPKOMW p. 119. Also print,69_2_B-121,black and white film copy negative,image/jpg,Image;StillImage,"Digital image, University of Idaho Library, 2015.",,"Beaver Creek, Benewah County, Idaho, United States",http://www.geonames.org/5585095/beaver-creek.html,47.1804,-116.4611,http://digital.lib.uidaho.edu:80/cdm/ref/collection/whitepine/id/245,245Tugboat Towing Logs,,"Tugboat towing brails of logs on St. Joe River, St. Maries, Idaho. Taken in Spring. Note log driver walking on logs.",1/1/39,,tugboats; rivers; log (wood);,"PG 6069 MG 69, White Pine: King of Many Waters Collection",Mountain Press Publishing Company,,69_2_I-116,black and white film negative,image/jpg,Image;StillImage,"Digital image, University of Idaho Library, 2015.",,"Saint Maries, Benewah County, Idaho, United States",http://www.geonames.org/5606232/saint-maries.html,47.3144,-116.5624,http://digital.lib.uidaho.edu:80/cdm/ref/collection/whitepine/id/247,247Crane Loading Logs,,"Crane loading Potlatch Forests, Incorporated logs from Stony Creek onto truck at the Merry Creek Landing, Clarkia, Idaho.",7/18/41,,log (wood); trucks; railroad (infrastructure); flatcars; freight cars; cranes (equipment);,"PG 6069 MG 69, White Pine: King of Many Waters Collection",Mountain Press Publishing Company,,69_2_I-122,black and white print,image/jpg,Image;StillImage,"Digital image, University of Idaho Library, 2015.",,"Merry Creek, Shoshone County, Idaho, United States",http://www.geonames.org/5600704/merry-creek.html,47.0115,-116.2527,http://digital.lib.uidaho.edu:80/cdm/ref/collection/whitepine/id/248,248Scaling Logs,,"Potlatch Forests, Incorporated logs being scaled before being loaded onto a truck. The scaler (man on left) is Ralph Todd. Merry Creek Landing, Clarkia, Idaho.",7/18/41,,log (wood); blue collar workers; trucks; log rules;,"PG 6069 MG 69, White Pine: King of Many Waters Collection",Mountain Press Publishing Company,,69_2_I-123,black and white film negative,image/jpg,Image;StillImage,"Digital image, University of Idaho Library, 2015.",,"Merry Creek, Shoshone County, Idaho, United States",http://www.geonames.org/5600704/merry-creek.html,47.0115,-116.2527,http://digital.lib.uidaho.edu:80/cdm/ref/collection/whitepine/id/249,249Flatcar and Truck Loaded with Logs,,"Potlatch Forests, Incorporated logs from Stony Creek, Merry Creek Landing, Clarkia, Idaho.",7/18/41,,log (wood); railroad (infrastructure); flatcars; freight cars; trucks; cranes (equipment);,"PG 6069 MG 69, White Pine: King of Many Waters Collection",Mountain Press Publishing Company,,69_2_I-124,black and white film negative,image/jpg,Image;StillImage,"Digital image, University of Idaho Library, 2015.",,"Merry Creek, Shoshone County, Idaho, United States",http://www.geonames.org/5600704/merry-creek.html,47.0115,-116.2527,http://digital.lib.uidaho.edu:80/cdm/ref/collection/whitepine/id/250,250Flatcars Loaded with Logs,,"Log train loaded with yellow pine, St. Maries, Idaho. Building in background reads: """"George O'Dwyer feed"""" Mr. O'Dwyer was the founder of a feed, grain, and building material business in St. Maries, Idaho.",6/7/42,,"log (wood); yellow pine (wood, general); flatcars; freight cars; railroad (infrastructure);","PG 6069 MG 69, White Pine: King of Many Waters Collection",Mountain Press Publishing Company,,69_2_I-126,black and white film negative,image/jpg,Image;StillImage,"Digital image, University of Idaho Library, 2015.",,"Saint Maries, Benewah County, Idaho, United States",http://www.geonames.org/5606232/saint-maries.html,47.3144,-116.5624,http://digital.lib.uidaho.edu:80/cdm/ref/collection/whitepine/id/251,251Sleigh Loaded with Logs,,"Sleigh loaded with logs, stacked logs in background.",,,log (wood); snow; winter; blue collar workers;,"PG 6069 MG 69, White Pine: King of Many Waters Collection",Mountain Press Publishing Company,,69_2_I-128,black and white film negative,image/jpg,Image;StillImage,"Digital image, University of Idaho Library, 2015.",,"Kootenai County, Idaho, United States",http://www.geonames.org/5597922/kootenai-county.html,47.6746,-116.7,http://digital.lib.uidaho.edu:80/cdm/ref/collection/whitepine/id/252,252Pack String,,Winton Lumber Company Pack string owned by Kirtley and Stone. Falls Creek. Credit Dick Reed. Heading to either camp #2 or #3.,1/1/28,,mules (mammals); hay;,"PG 6069 MG 69, White Pine: King of Many Waters Collection",Mountain Press Publishing Company,,69_2_I-129,black and white print,image/jpg,Image;StillImage,"Digital image, University of Idaho Library, 2015.",,"Falls Creek, Shoshone County, Idaho, United States",http://www.geonames.org/5592790/falls-creek.html,47.7461,-116.0209,http://digital.lib.uidaho.edu:80/cdm/ref/collection/whitepine/id/253,253Falls Creek Chute Landing and Flume,,"Winton Lumber Company Falls Creek chute landing (chute left of log deck, out of picture). Peavy man tailing logs into flume. Credit Dick Reed.",1/1/25,yes,log (wood); flumes; blue collar workers; peavies;,"PG 6069 MG 69, White Pine: King of Many Waters Collection",Mountain Press Publishing Company,,69_2_I-130,black and white print,image/jpg,Image;StillImage,"Digital image, University of Idaho Library, 2015.",,"Falls Creek, Shoshone County, Idaho, United States",http://www.geonames.org/5592790/falls-creek.html,47.7461,-116.0209,http://digital.lib.uidaho.edu:80/cdm/ref/collection/whitepine/id/254,254Falls Creek Chute Landing and Flume,,"Winton Lumber Company Falls Creek chute landing (chute left of log deck, out of picture). Peavy man tailing logs into flume. Credit Dick Reed.",1/1/25,yes,log (wood); flumes; blue collar workers; peavies;,"PG 6069 MG 69, White Pine: King of Many Waters Collection",Mountain Press Publishing Company,,69_2_I-131,black and white print,image/jpg,Image;StillImage,"Digital image, University of Idaho Library, 2015.",,"Falls Creek, Shoshone County, Idaho, United States",http://www.geonames.org/5592790/falls-creek.html,47.7461,-116.0209,http://digital.lib.uidaho.edu:80/cdm/ref/collection/whitepine/id/255,255Winton Lumber Company Flume,,"Rearing"""" a flume, Falls Creek. Feeder flume under construction on left. Credit Dick Reed.",1/1/25,yes,log (wood); flumes; blue collar workers;,"PG 6069 MG 69, White Pine: King of Many Waters Collection",Mountain Press Publishing Company,,69_2_I-132,black and white print,image/jpg,Image;StillImage,"Digital image, University of Idaho Library, 2015.",,"Falls Creek, Shoshone County, Idaho, United States",http://www.geonames.org/5592790/falls-creek.html,47.7461,-116.0209,http://digital.lib.uidaho.edu:80/cdm/ref/collection/whitepine/id/256,256Winton Lumber Company Flume,,Water flowing and logs being separated in the Falls Creek flume. Feeder flume under construction on left. Credit Dick Reed.,1/1/25,yes,log (wood); flumes; blue collar workers;,"PG 6069 MG 69, White Pine: King of Many Waters Collection",Mountain Press Publishing Company,,69_2_I-133,black and white print,image/jpg,Image;StillImage,"Digital image, University of Idaho Library, 2015.",,"Falls Creek, Shoshone County, Idaho, United States",http://www.geonames.org/5592790/falls-creek.html,47.7461,-116.0209,http://digital.lib.uidaho.edu:80/cdm/ref/collection/whitepine/id/258,258Falls Creek Chute Landing and Log Deck,,"Falls Creek chute landing. Tow path right, foreground. Path made of logs and puncheon smoothed with foot adz. Straight line in the center of the path is probably a decking line to enable the logs to be decked by a cross haul arrangement. Small """"cats"""" (tractors) used to tow logs. About the first use of cats for this purpose. Note that the chute (last two logs on left) has been laid almost flat as was usual when logs were going to be decked at the landing. This made it easier for the peavey man to roll the logs onto the deck. Chute went to the last deck in the background on the left. Credit Dick Reed.",1/1/25,yes,log (wood); chutes; blue collar workers; peavies;,"PG 6069 MG 69, White Pine: King of Many Waters Collection",Mountain Press Publishing Company,,69_2_I-134,black and white print,image/jpg,Image;StillImage,"Digital image, University of Idaho Library, 2015.",,"Falls Creek, Shoshone County, Idaho, United States",http://www.geonames.org/5592790/falls-creek.html,47.7461,-116.0209,http://digital.lib.uidaho.edu:80/cdm/ref/collection/whitepine/id/259,259Falls Creek Chute,,"Winton Lumber Company running chute, Falls Creek. """"goose necks"""" were used on this chute to """"slow down"""" the running logs. Credit Dick Reed.",1/1/25,yes,log (wood); chutes; dogs (devices for wood);,"PG 6069 MG 69, White Pine: King of Many Waters Collection",Mountain Press Publishing Company,,69_2_I-135,black and white print,image/jpg,Image;StillImage,"Digital image, University of Idaho Library, 2015.",,"Falls Creek, Shoshone County, Idaho, United States",http://www.geonames.org/5592790/falls-creek.html,47.7461,-116.0209,http://digital.lib.uidaho.edu:80/cdm/ref/collection/whitepine/id/260,260Benewah Creek Flume,Clarence C. Strong,Benewah Creek Flume. Built by Fred Herrick in 1915-16.,1/1/68,,flumes;,"PG 6069 MG 69, White Pine: King of Many Waters Collection",Mountain Press Publishing Company,,69_2_I-50,black and white print,image/jpg,Image;StillImage,"Digital image, University of Idaho Library, 2015.",,"Benewah Creek, Benewah County, Idaho, United States",http://www.geonames.org/5585305/benewah-creek.html,47.2505,-116.7644,http://digital.lib.uidaho.edu:80/cdm/ref/collection/whitepine/id/261,261Sleigh Loaded with Logs,,"Sleigh loaded with logs, stacked logs in background.",,,log (wood); draft horses; snow; winter; blue collar workers;,"PG 6069 MG 69, White Pine: King of Many Waters Collection",Mountain Press Publishing Company,,69_2_I-127,black and white film negative,image/jpg,Image;StillImage,"Digital image, University of Idaho Library, 2015.",,"Kootenai County, Idaho, United States",http://www.geonames.org/5597922/kootenai-county.html,47.6746,-116.7,http://digital.lib.uidaho.edu:80/cdm/ref/collection/whitepine/id/262,262